{
  "skill_composition_version": 1,
  "skills": [
    {
      "composition_class": "multi_technique",
      "exception_review_path": null,
      "name": "abyss-safe-infra-change",
      "recommended_action": "keep_multi_technique",
      "technique_count": 2,
      "technique_ids": [
        "AOA-T-0028",
        "AOA-T-0001"
      ]
    },
    {
      "composition_class": "multi_technique",
      "exception_review_path": null,
      "name": "abyss-sanitized-share",
      "recommended_action": "keep_multi_technique",
      "technique_count": 2,
      "technique_ids": [
        "AOA-T-0034",
        "AOA-T-0002"
      ]
    },
    {
      "composition_class": "multi_technique",
      "exception_review_path": null,
      "name": "abyss-self-diagnostic-spine",
      "recommended_action": "keep_multi_technique",
      "technique_count": 2,
      "technique_ids": [
        "AOA-T-0080",
        "AOA-T-0081"
      ]
    },
    {
      "composition_class": "multi_technique",
      "exception_review_path": null,
      "name": "aoa-adr-write",
      "recommended_action": "keep_multi_technique",
      "technique_count": 2,
      "technique_ids": [
        "AOA-T-0033",
        "AOA-T-0002"
      ]
    },
    {
      "composition_class": "single_technique_exception",
      "exception_review_path": "docs/reviews/skill-composition-exceptions/aoa-approval-gate-check.md",
      "name": "aoa-approval-gate-check",
      "recommended_action": "keep_exception",
      "technique_count": 1,
      "technique_ids": [
        "AOA-T-0028"
      ]
    },
    {
      "composition_class": "multi_technique",
      "exception_review_path": null,
      "name": "aoa-automation-opportunity-scan",
      "recommended_action": "keep_multi_technique",
      "technique_count": 3,
      "technique_ids": [
        "AOA-T-0086",
        "AOA-T-0087",
        "AOA-T-0088"
      ]
    },
    {
      "composition_class": "multi_technique",
      "exception_review_path": null,
      "name": "aoa-bounded-context-map",
      "recommended_action": "keep_multi_technique",
      "technique_count": 2,
      "technique_ids": [
        "AOA-T-0016",
        "AOA-T-0002"
      ]
    },
    {
      "composition_class": "multi_technique",
      "exception_review_path": null,
      "name": "aoa-change-protocol",
      "recommended_action": "keep_multi_technique",
      "technique_count": 2,
      "technique_ids": [
        "AOA-T-0001",
        "AOA-T-0002"
      ]
    },
    {
      "composition_class": "multi_technique",
      "exception_review_path": null,
      "name": "aoa-checkpoint-closeout-bridge",
      "recommended_action": "keep_multi_technique",
      "technique_count": 3,
      "technique_ids": [
        "AOA-T-0075",
        "AOA-T-0084",
        "AOA-T-0089"
      ]
    },
    {
      "composition_class": "multi_technique",
      "exception_review_path": null,
      "name": "aoa-commit-growth-seam",
      "recommended_action": "keep_multi_technique",
      "technique_count": 2,
      "technique_ids": [
        "AOA-T-0001",
        "AOA-T-0028"
      ]
    },
    {
      "composition_class": "multi_technique",
      "exception_review_path": null,
      "name": "aoa-contract-test",
      "recommended_action": "keep_multi_technique",
      "technique_count": 2,
      "technique_ids": [
        "AOA-T-0003",
        "AOA-T-0015"
      ]
    },
    {
      "composition_class": "multi_technique",
      "exception_review_path": null,
      "name": "aoa-core-logic-boundary",
      "recommended_action": "keep_multi_technique",
      "technique_count": 2,
      "technique_ids": [
        "AOA-T-0016",
        "AOA-T-0015"
      ]
    },
    {
      "composition_class": "multi_technique",
      "exception_review_path": null,
      "name": "aoa-dry-run-first",
      "recommended_action": "keep_multi_technique",
      "technique_count": 2,
      "technique_ids": [
        "AOA-T-0004",
        "AOA-T-0028"
      ]
    },
    {
      "composition_class": "single_technique_exception",
      "exception_review_path": "docs/reviews/skill-composition-exceptions/aoa-invariant-coverage-audit.md",
      "name": "aoa-invariant-coverage-audit",
      "recommended_action": "keep_exception",
      "technique_count": 1,
      "technique_ids": [
        "AOA-T-0017"
      ]
    },
    {
      "composition_class": "multi_technique",
      "exception_review_path": null,
      "name": "aoa-local-stack-bringup",
      "recommended_action": "keep_multi_technique",
      "technique_count": 4,
      "technique_ids": [
        "AOA-T-0036",
        "AOA-T-0037",
        "AOA-T-0028",
        "AOA-T-0038"
      ]
    },
    {
      "composition_class": "multi_technique",
      "exception_review_path": null,
      "name": "aoa-port-adapter-refactor",
      "recommended_action": "keep_multi_technique",
      "technique_count": 2,
      "technique_ids": [
        "AOA-T-0016",
        "AOA-T-0015"
      ]
    },
    {
      "composition_class": "multi_technique",
      "exception_review_path": null,
      "name": "aoa-property-invariants",
      "recommended_action": "keep_multi_technique",
      "technique_count": 2,
      "technique_ids": [
        "AOA-T-0017",
        "AOA-T-0007"
      ]
    },
    {
      "composition_class": "multi_technique",
      "exception_review_path": null,
      "name": "aoa-quest-harvest",
      "recommended_action": "keep_multi_technique",
      "technique_count": 2,
      "technique_ids": [
        "AOA-T-0089",
        "AOA-T-0090"
      ]
    },
    {
      "composition_class": "multi_technique",
      "exception_review_path": null,
      "name": "aoa-safe-infra-change",
      "recommended_action": "keep_multi_technique",
      "technique_count": 2,
      "technique_ids": [
        "AOA-T-0028",
        "AOA-T-0001"
      ]
    },
    {
      "composition_class": "multi_technique",
      "exception_review_path": null,
      "name": "aoa-sanitized-share",
      "recommended_action": "keep_multi_technique",
      "technique_count": 2,
      "technique_ids": [
        "AOA-T-0034",
        "AOA-T-0002"
      ]
    },
    {
      "composition_class": "multi_technique",
      "exception_review_path": null,
      "name": "aoa-session-donor-harvest",
      "recommended_action": "keep_multi_technique",
      "technique_count": 3,
      "technique_ids": [
        "AOA-T-0075",
        "AOA-T-0076",
        "AOA-T-0077"
      ]
    },
    {
      "composition_class": "multi_technique",
      "exception_review_path": null,
      "name": "aoa-session-progression-lift",
      "recommended_action": "keep_multi_technique",
      "technique_count": 2,
      "technique_ids": [
        "AOA-T-0084",
        "AOA-T-0085"
      ]
    },
    {
      "composition_class": "multi_technique",
      "exception_review_path": null,
      "name": "aoa-session-route-forks",
      "recommended_action": "keep_multi_technique",
      "technique_count": 2,
      "technique_ids": [
        "AOA-T-0078",
        "AOA-T-0079"
      ]
    },
    {
      "composition_class": "multi_technique",
      "exception_review_path": null,
      "name": "aoa-session-self-diagnose",
      "recommended_action": "keep_multi_technique",
      "technique_count": 2,
      "technique_ids": [
        "AOA-T-0080",
        "AOA-T-0081"
      ]
    },
    {
      "composition_class": "multi_technique",
      "exception_review_path": null,
      "name": "aoa-session-self-repair",
      "recommended_action": "keep_multi_technique",
      "technique_count": 2,
      "technique_ids": [
        "AOA-T-0082",
        "AOA-T-0083"
      ]
    },
    {
      "composition_class": "multi_technique",
      "exception_review_path": null,
      "name": "aoa-source-of-truth-check",
      "recommended_action": "keep_multi_technique",
      "technique_count": 3,
      "technique_ids": [
        "AOA-T-0013",
        "AOA-T-0002",
        "AOA-T-0009"
      ]
    },
    {
      "composition_class": "multi_technique",
      "exception_review_path": null,
      "name": "aoa-summon",
      "recommended_action": "keep_multi_technique",
      "technique_count": 2,
      "technique_ids": [
        "AOA-T-PENDING-SUMMON-LANE-SELECTION",
        "AOA-T-PENDING-SUMMON-RETURN-GOVERNANCE"
      ]
    },
    {
      "composition_class": "multi_technique",
      "exception_review_path": null,
      "name": "aoa-tdd-slice",
      "recommended_action": "keep_multi_technique",
      "technique_count": 2,
      "technique_ids": [
        "AOA-T-0014",
        "AOA-T-0001"
      ]
    },
    {
      "composition_class": "multi_technique",
      "exception_review_path": null,
      "name": "atm10-change-protocol",
      "recommended_action": "keep_multi_technique",
      "technique_count": 2,
      "technique_ids": [
        "AOA-T-0001",
        "AOA-T-0002"
      ]
    },
    {
      "composition_class": "multi_technique",
      "exception_review_path": null,
      "name": "atm10-source-of-truth-check",
      "recommended_action": "keep_multi_technique",
      "technique_count": 2,
      "technique_ids": [
        "AOA-T-0013",
        "AOA-T-0002"
      ]
    },
    {
      "composition_class": "multi_technique",
      "exception_review_path": null,
      "name": "titan-approval-ledger",
      "recommended_action": "keep_multi_technique",
      "technique_count": 2,
      "technique_ids": [
        "AOA-T-PENDING-TITAN-GATE-DISCIPLINE",
        "AOA-T-PENDING-TITAN-RECEIPT-LINEAGE"
      ]
    },
    {
      "composition_class": "multi_technique",
      "exception_review_path": null,
      "name": "titan-approval-loom",
      "recommended_action": "keep_multi_technique",
      "technique_count": 2,
      "technique_ids": [
        "AOA-T-PENDING-TITAN-GATE-DISCIPLINE",
        "AOA-T-PENDING-TITAN-RECEIPT-LINEAGE"
      ]
    },
    {
      "composition_class": "multi_technique",
      "exception_review_path": null,
      "name": "titan-appserver-bridge",
      "recommended_action": "keep_multi_technique",
      "technique_count": 2,